{
  "domain": "renal-care-continuity",
  "as_of": "2026-09-30",
  "description": "虚构样例：三位慢性肾病透析患者在区域医联体内的跨院取药事实流。所有人名、机构与数据均为虚构。",
  "drug_catalog": {
    "ESA-ALFA": { "name": "重组促红素α（虚构代号）", "unit": "IU" },
    "P-BINDER": { "name": "磷结合剂（虚构代号）", "unit": "袋" }
  },
  "records": [
    {
      "type": "patient_alias",
      "payload": { "patient_code": "P-CKD-1001" },
      "actor": { "id": "op-region-01", "role": "hospital_operator" }
    },
    {
      "type": "dialysis_schedule",
      "payload": {
        "patient_code": "P-CKD-1001",
        "site_code": "SITE-A",
        "schedule": "周一/周三/周五 上午",
        "effective_from": "2026-01-05",
        "effective_to": "2026-08-31"
      },
      "actor": { "id": "op-region-01", "role": "hospital_operator" }
    },
    {
      "type": "dialysis_schedule",
      "payload": {
        "patient_code": "P-CKD-1001",
        "site_code": "SITE-B",
        "schedule": "周二/周四/周六 上午",
        "effective_from": "2026-09-01"
      },
      "actor": { "id": "op-region-01", "role": "hospital_operator" }
    },
    {
      "type": "care_episode",
      "payload": {
        "patient_code": "P-CKD-1001",
        "episode_id": "EP-1001-01",
        "site_code": "SITE-A",
        "admitted_on": "2026-01-05",
        "transferred_out_on": "2026-08-31",
        "kind": "routine"
      },
      "actor": { "id": "op-region-01", "role": "hospital_operator" }
    },
    {
      "type": "care_episode",
      "payload": {
        "patient_code": "P-CKD-1001",
        "episode_id": "EP-1001-02",
        "site_code": "SITE-B",
        "admitted_on": "2026-09-01",
        "kind": "routine"
      },
      "actor": { "id": "op-region-01", "role": "hospital_operator" }
    },
    {
      "type": "regimen_version",
      "payload": {
        "patient_code": "P-CKD-1001",
        "version": 1,
        "effective_from": "2026-01-05",
        "items": [
          { "drug_code": "ESA-ALFA", "daily_dose": 4000, "daily_max": 6000, "unit": "IU", "note": "按周剂量折算的日均剂量" },
          { "drug_code": "P-BINDER", "daily_dose": 3, "daily_max": 4, "unit": "袋" }
        ]
      },
      "actor": { "id": "dr-a-01", "role": "clinician" }
    },
    {
      "type": "prescription",
      "payload": {
        "patient_code": "P-CKD-1001", "prescription_id": "RX-1001-01", "site_code": "SITE-A",
        "drug_code": "ESA-ALFA", "daily_dose": 4000, "unit": "IU", "quantity": 120000, "issued_on": "2026-07-21"
      },
      "actor": { "id": "dr-a-01", "role": "clinician" }
    },
    {
      "type": "dispense",
      "payload": {
        "patient_code": "P-CKD-1001", "prescription_id": "RX-1001-01", "site_code": "SITE-A",
        "drug_code": "ESA-ALFA", "quantity": 120000, "unit": "IU", "dispensed_on": "2026-07-21"
      },
      "actor": { "id": "op-sitea-02", "role": "hospital_operator" }
    },
    {
      "type": "prescription",
      "payload": {
        "patient_code": "P-CKD-1001", "prescription_id": "RX-1001-02", "site_code": "SITE-A",
        "drug_code": "ESA-ALFA", "daily_dose": 4000, "unit": "IU", "quantity": 120000, "issued_on": "2026-08-20"
      },
      "actor": { "id": "dr-a-01", "role": "clinician" }
    },
    {
      "type": "dispense",
      "payload": {
        "patient_code": "P-CKD-1001", "prescription_id": "RX-1001-02", "site_code": "SITE-A",
        "drug_code": "ESA-ALFA", "quantity": 120000, "unit": "IU", "dispensed_on": "2026-08-20"
      },
      "actor": { "id": "op-sitea-02", "role": "hospital_operator" }
    },
    {
      "type": "exception_grant",
      "payload": {
        "patient_code": "P-CKD-1001", "grant_id": "GR-1001-transfer",
        "reason": "transfer", "drug_codes": ["ESA-ALFA"],
        "valid_from": "2026-09-01", "valid_to": "2026-09-14",
        "basis": "透析地点由 SITE-A 调整至 SITE-B，转院期续药"
      },
      "actor": { "id": "op-region-01", "role": "hospital_operator" }
    },
    {
      "type": "prescription",
      "payload": {
        "patient_code": "P-CKD-1001", "prescription_id": "RX-1001-03", "site_code": "SITE-B",
        "drug_code": "ESA-ALFA", "daily_dose": 4000, "unit": "IU", "quantity": 120000, "issued_on": "2026-09-01"
      },
      "actor": { "id": "dr-b-02", "role": "clinician" }
    },
    {
      "type": "dispense",
      "payload": {
        "patient_code": "P-CKD-1001", "prescription_id": "RX-1001-03", "site_code": "SITE-B",
        "drug_code": "ESA-ALFA", "quantity": 120000, "unit": "IU", "dispensed_on": "2026-09-01"
      },
      "actor": { "id": "op-siteb-03", "role": "hospital_operator" }
    },
    {
      "type": "clinician_note",
      "payload": {
        "patient_code": "P-CKD-1001", "note_id": "NOTE-1001-01", "noted_on": "2026-09-01",
        "text": "患者按医联体安排转入本院继续透析，沿原方案续开 ESA-ALFA，日剂量未调整；SITE-A 剩余库存由患者继续使用，属转院衔接，非重复治疗。",
        "links": [
          "P-CKD-1001:early_refill:ESA-ALFA|2026-08-20|2026-09-01",
          "P-CKD-1001:dose_overlap:ESA-ALFA|RX-1001-02|RX-1001-03"
        ]
      },
      "actor": { "id": "dr-b-02", "role": "clinician" }
    },

    {
      "type": "patient_alias",
      "payload": { "patient_code": "P-CKD-1002" },
      "actor": { "id": "op-region-01", "role": "hospital_operator" }
    },
    {
      "type": "dialysis_schedule",
      "payload": {
        "patient_code": "P-CKD-1002",
        "site_code": "SITE-C",
        "schedule": "周一/周四 下午",
        "effective_from": "2026-02-01"
      },
      "actor": { "id": "op-region-01", "role": "hospital_operator" }
    },
    {
      "type": "care_episode",
      "payload": {
        "patient_code": "P-CKD-1002", "episode_id": "EP-1002-01", "site_code": "SITE-C",
        "admitted_on": "2026-02-01", "transferred_out_on": "2026-09-10", "kind": "routine"
      },
      "actor": { "id": "op-region-01", "role": "hospital_operator" }
    },
    {
      "type": "care_episode",
      "payload": {
        "patient_code": "P-CKD-1002", "episode_id": "EP-1002-02", "site_code": "SITE-D",
        "admitted_on": "2026-09-10", "transferred_out_on": "2026-09-12", "kind": "emergency"
      },
      "actor": { "id": "op-sited-04", "role": "hospital_operator" }
    },
    {
      "type": "care_episode",
      "payload": {
        "patient_code": "P-CKD-1002", "episode_id": "EP-1002-03", "site_code": "SITE-C",
        "admitted_on": "2026-09-12", "kind": "routine"
      },
      "actor": { "id": "op-region-01", "role": "hospital_operator" }
    },
    {
      "type": "regimen_version",
      "payload": {
        "patient_code": "P-CKD-1002",
        "version": 1,
        "effective_from": "2026-02-01",
        "items": [
          { "drug_code": "ESA-ALFA", "daily_dose": 4000, "daily_max": 6000, "unit": "IU", "note": "按周剂量折算的日均剂量" },
          { "drug_code": "P-BINDER", "daily_dose": 3, "daily_max": 4, "unit": "袋" }
        ]
      },
      "actor": { "id": "dr-c-03", "role": "clinician" }
    },
    {
      "type": "prescription",
      "payload": {
        "patient_code": "P-CKD-1002", "prescription_id": "RX-1002-01", "site_code": "SITE-C",
        "drug_code": "ESA-ALFA", "daily_dose": 4000, "unit": "IU", "quantity": 120000, "issued_on": "2026-08-11"
      },
      "actor": { "id": "dr-c-03", "role": "clinician" }
    },
    {
      "type": "dispense",
      "payload": {
        "patient_code": "P-CKD-1002", "prescription_id": "RX-1002-01", "site_code": "SITE-C",
        "drug_code": "ESA-ALFA", "quantity": 120000, "unit": "IU", "dispensed_on": "2026-08-11"
      },
      "actor": { "id": "op-sitec-05", "role": "hospital_operator" }
    },
    {
      "type": "prescription",
      "payload": {
        "patient_code": "P-CKD-1002", "prescription_id": "RX-1002-02", "site_code": "SITE-C",
        "drug_code": "ESA-ALFA", "daily_dose": 4000, "unit": "IU", "quantity": 120000, "issued_on": "2026-09-10"
      },
      "actor": { "id": "dr-c-03", "role": "clinician" }
    },
    {
      "type": "dispense",
      "payload": {
        "patient_code": "P-CKD-1002", "prescription_id": "RX-1002-02", "site_code": "SITE-C",
        "drug_code": "ESA-ALFA", "quantity": 120000, "unit": "IU", "dispensed_on": "2026-09-10"
      },
      "actor": { "id": "op-sitec-05", "role": "hospital_operator" }
    },
    {
      "type": "prescription",
      "payload": {
        "patient_code": "P-CKD-1002", "prescription_id": "RX-1002-03", "site_code": "SITE-D",
        "drug_code": "ESA-ALFA", "daily_dose": 4000, "unit": "IU", "quantity": 120000, "issued_on": "2026-09-10",
        "note": "急诊住院期间按透析方案续用"
      },
      "actor": { "id": "dr-d-04", "role": "clinician" }
    },
    {
      "type": "dispense",
      "payload": {
        "patient_code": "P-CKD-1002", "prescription_id": "RX-1002-03", "site_code": "SITE-D",
        "drug_code": "ESA-ALFA", "quantity": 120000, "unit": "IU", "dispensed_on": "2026-09-10"
      },
      "actor": { "id": "op-sited-04", "role": "hospital_operator" }
    },
    {
      "type": "exception_grant",
      "payload": {
        "patient_code": "P-CKD-1002", "grant_id": "GR-1002-emergency",
        "reason": "emergency",
        "valid_from": "2026-09-10", "valid_to": "2026-09-13",
        "basis": "急诊入住 SITE-D，住院期间续药"
      },
      "actor": { "id": "op-region-01", "role": "hospital_operator" }
    },
    {
      "type": "temp_hold",
      "payload": {
        "patient_code": "P-CKD-1002", "hold_id": "HOLD-1002-01",
        "reason": "同日多院领取 ESA-ALFA，风险模型自动临时限制",
        "held_on": "2026-09-10"
      },
      "actor": { "id": "op-region-01", "role": "hospital_operator" }
    },
    {
      "type": "hospital_supplement",
      "payload": {
        "patient_code": "P-CKD-1002", "supplement_id": "SUP-1002-01", "site_code": "SITE-D",
        "submitted_on": "2026-09-11",
        "text": "补传急诊留观记录（不含完整病历）：患者 2026-09-10 因透析并发症急诊留观至 09-12，住院期间用药由本院药房发放。",
        "links": ["P-CKD-1002:same_day_duplicate:ESA-ALFA|2026-09-10|SITE-C,SITE-D"],
        "related_prescription_ids": ["RX-1002-03"]
      },
      "actor": { "id": "op-sited-04", "role": "hospital_operator" }
    },
    {